name,line
Brian," Meg, how can you watch that crap? That show's not reality. It's all staged. It's a complete mockery of human relationships."
Chris," You're a good pimple, Doug."
Doug, Feed me!
Chris, ( gasps ) You... talk!
Doug, That's right. And we're gonna raise some hell. All right! Raise some hell!
Cleveland," Peter, I can't do this. I'm too nervous. I gotta go."
Peter," No, no, Cleveland, I'm not going to let you do this. I'll tie you down if I have to."
Cleveland," Peter, this is only making it worse. Oh, God, my claustrophobia is setting in!"
Peter," It's all right, it's all right, it's okay. It's all right. It's the fabric. It's the fabric. It's your clothes. All right, let's get your clothes off."
Cleveland," Peter! Peter, what's wrong with you? I'm naked."
Peter," Oh, God, you're self-conscious. I'm sorry. Here, you know what? Look, look. Cleveland. Look. See? See? Now you're not alone. You're not alone, Cleveland."
Cleveland, Let me out of here! I need to get out of here!
Peter," Cleveland, no. No, you're staying. This, this for your own good. This is for your own good."
Brian," Hi. Yeah, listen, I just wanted to apologize for Peter. He was just trying to help out his friend. You see, his wife left him and he's been kind of lonely, confused about what he really wants."
Brian, Brian.
Brian," They are stupid, but I figure I got a few days of free booze and free food before they kick me off. I could use a vacation."
Stewie," Oh, yes, 'cause you've got such a heavy workload around here. Hmm, how you, uh... how you coming on that novel you working on? Hmm? Got a big, uh, big stack of papers there? Got a, got a, got a nice little story you working on there? Your big -big novel you've been working on for three years? ( voice rising in pitch ) Hmm? Got a, got a compelling protagonist, eh? Got a, got an obstacle for him to overcome? Huh? Got a story brewing there? Working on... Working on that for quite some time, huh? Yeah, talking about that three years ago. You've been working on that the whole time? Nice little, uh, narrative-- beginning, middle and end? Some friends become enemies, some enemies become friends? Eh? At the end your main character is richer ( voice still higher in pitch ) for the experience, yeah? Yeah? Yeah, you've got, uh-- no, no. You deserve some time off. I'm super-excited. You think she'll be hot? I bet she'll be hot. I think she'll be hot, too!"
Lois," Peter, I 'm getting a little worried about Chris. All he does lately is sit alone in his room talking to that zit."
Peter," Oh, relax, Lois. What's a zit going to do? Talk to him and tell him to sneak out of the house and cause trouble?"
Doug," Now light it, ring the doorbell, and run like hell!"
Chris," I don't know about this, Doug."
Doug, Just do it! ( doorbell rings )
Joe," Oh, good Lord! Is that. .. Doody!"
Bonnie," I'm doing the dishes, Joe. I'll change you in a minute."
Trevor," I wasn't too nervous. I mean, when I'm nervous I work out and I wasn't working out, so I must not have been nervous. I was... I was very pleased and surprised."
Brian," I really was not expecting an open bar. Top shelf booze, I tell you. And this guy knew his stuff. Made me a mojito. I don't think it's a gay drink. Mo-ji-to."
Quagmire, ( breathlessly ) Giggity... giggity... giggity. ..
Quagmire, Giggity... giggity... giggity. .. (sighing)
Trevor," Dude, put your pants on."
Quagmire ," shut up! Well, I really like all the guys, but some of them seem Sa little too competitive. I uh, I gotta tell ya, I don't know what she would possibly see in Count Chocula. I-I thin k he's just here because he's a minority."
Chris," You were right, Doug! Mischief is fun! We're the best pals since the Snorks."
Brooke, Brian.
Brian, What? Are you serious?
Brooke, I feel like I didn't get to know you at all. Would you accept this rose?
Brian," ( sighing) All right, but I think this whole thing is about as pointless as Peter's cow kite."
Stewie," Ooh, that means this room is mine now. Man, I'm going to party my ass off in here."
Stewie," Yeah, I got it from our cleaning lady's boyfriend. It's okay, though, 'cause she's gonna use the money to get a mammogram."
Lois, Chris! Where have you been?
Chris, Doug told me I don't need to listen to you.
Lois," Doug? Your pimple? Oh, that is it! First thing tomorrow we're going down to Goldman's pharmacy and get some astringent to get rid of that thing."
Doug, What did I tell you? She's trying to drive us apart. We can't let that happen. I am in no mood!
Brian," Oh, come on. You can' t expect me to ride that thing."
Brian, Brooke? What are you doing here?
Brooke," Ooh, I just can't take it anymore. All these guys just coming on to me. I had to sneak off. Oh, could I bum one of those?"
Brian," You know , I don't even know why I agreed to do this show. This is just so not me. I would much rather just be home, listening to my old jazz records."
Brooke," Really? You know , I actually have quite a jazz collection myself."
Brian, Who do you like?
Brooke, DJ Jazzy Jeff.
Brian, Oh.
Brooke, I'm kidding. ( laughing )
Brian," Oh! You got me. You got me, yeah."
Brooke," No, I really like Coleman Hawkins, Ben Webster... ooh, and early Coltrane, before he got clean."
Brian,"Yeah, yeah, no junk, no soul."
Brooke," No kidding. I mean, look at Chevy Chase."
Brian," Right, right. You know , I gotta say, I thought she was just some actress looking for her 15 minutes of fame, but she's, uh... she's pretty sharp, you know? I guess you can't judge a Brooke by her cover. ( chuckling ) You can... you can cut that out, right? Oh, and maybe you can cut when I said ""junk"" earlier, the whole Chevy Chase thing. Seems like he's probably the kind of guy who might sue. I mean, the guy's gotta have no money left."
Lois," Oh, my God. Peter, d o you think Chris might have done this?"
Peter," Come on, Lois, he doesn't have the wild streak you had when you were younger. For God' s sake, you used to make plaster molds of celebrity body parts."
Lois," Okay, Daryl, it's almost dry. Very nice, by the way. This one 's going on the shelf right next to Dan Fogelberg."
 ,"Hey, Lois. Am I up next?"
Lois," Just wait in your dressing room. I'll come back for you, Oates. ( door closes ) I'm not coming back for Oates."
Brooke," Glenn, will you accept this rose?"
Quagmire, Really? After I drugged you and tried to have sex with your unconscious body?
Brooke, What?
Quagmire, Yes.
 Peter," Brian! Welcome home, you son of a bitch! So, did you lose? ! You got to tell me all about it. Hey, how was the bachelorette? Was she a dumb bimbo, like you said, but with a big rack? ( laughs ) Come on in and tell me everything. I bet your stories will make me laugh so hard I shoot milk out of my nose."
Brian," Um, Peter, this is Brooke, the bachelorette. She's, uh, having dinner with us tonight. I went over this with you a few minutes ago."
Peter,(laughing and then shooting milk out of his nose)
Joe,"Peter, Lois, we h ave proof that it was Chris who vandalized Goldman's Pharmacy. I knew it. I knew it! I didn't want to believe it, but it's true."
JOE, Do you know what a cavity search is? You made my mom c
 Quagmire," Glenn, would you feed Mittens?"
Quagmire, Mittens has food in his bowl.
 Quagmire, That's old food. (Mittens meowing )
Quagmire," Mittens, shut up. Mittens, shut up!"
 Quagmire, Don't you talk to Mittens that way! Mittens is a member of this family!
Quagmire," Mom, you want this three-way to happen, you're going to have to change your tone."
Brian," My God, you've just made me the happiest dog in the world. I love you, Brooke."
Brooke," I love you too, Brian. All right, that's a wrap. Well, it was great working with you, Brian. Good luck."
Brian, What? What are you talking about? Wh-What about us?
Michael Eisner," Hi , Brian."
Brian, Michael Eisner?
Michael," On behalf of ABC, I'd like to give you this parting gift."
Brian, The bill for the mansion?
Michael," No givesies backsies! ( phone line rings ) Uh, hey, Brooke. It's, uh, it's me again-- Brian. Hi. Wasn't sure if you got my last message. Or, uh, any of the other ones. Um, anyway, I'll just leave a quick message, 'cause you might be trying to call me right now and I don't want to tie up the line, so, I guess, um... Uh, I guess, yeah, give me a call. Okay, I'm hanging up. In three, two, one. Okay, call me back. I'll be here. All day. And tonight. Okay, bye. (phone rings) Uh, hey, me again. Thought I might have heard a voice when I was hanging up. Nope? Guess not. Okay, I will talk to you soon. Hello? No, sorry. Hey, babe, just trying you again, listening to our guy Coltrane... you know, okay... Anyway, I got a fax earlier about cheap airfare to Cancun. Didn't know if that was you trying to reach me. Uh, you know, let me give you my home number again, just in case you lost it... Electronic voice: voice mail is full. Damn."
Delivery Man, (doorbell ringing) Package for Brooke Roberts.
Brooke," Oh, that's me, thanks."
Brian," (on new machine) Uh, hey, there. Me again. Your voice mail was full, so I got you this answering machine. So, uh, what's go ing on?! I'm thinking about doing something tonight..."
Brian," Hey, you're home."
Brooke," Listen, Brian, I want you to leave me alone or I am calling the cops."
Brian," ? Brooke, I'm so in love with you... ?"
Doug," Aw! Oh! Aw! Aw! Chris, where the hell are we?"
Chris," I told you, Doug, thi s is the bacon factory. Doctor, I need you to get rid of this zit!"
Doug, You traitor!
Doctor," Whoa, that's a doozy. I bet some of those awful kids at school call you zit face. ""No."" Papa Zit? ""No."" Puss Peak? ""No."" Fat ass? Well, yeah. Tsk, tsk. Oh, that's terrible. Well, we're going to have to use some cortisone on that."
Doug," Oh, yeah? Two can play at that game. (gunshot) Don't think I won't do it, man!"
Chris," All right, all right, let's all be cool here... (grunting)"
Doctor," No! Whew! You okay, fat ass?"
Brian," She told me she loved me, on what used to be a hit TV show. God, I can't believe I got sucked in to that phony reality world just like everyone else. I became the very thing I was mocking."
Stewie," Oh, I know it hurts now, Brian, but look at the bright side. You have some new material for that novel you've been writing. You know, the novel you've been working on. You know, the one you've been working on for three years? (voice rising in pitch): You know, the novel? Got something new to write about now, you know? Maybe your... maybe your main character gets into a relationship? (voices rises in pitch again) Suffers a little heartbreak? Something like what-what you've been... you've just been through? Draw from real-life experiences? A little heartbreak, you know, work it into the story? Make those characters a little more three dimensional? (very high pitch) A little richer experience for the reader? Make those second hundred pages really keep the reader guessing what's going to happen? Some twists and turns? (squeaking in high falsetto) A little epilogue? Everybody learns the hero's journey isn't always a happy one? (normal voice) Oh, I look forward to reading it."
Lois," Thanks for babysitting, Meg. We'll be back in a couple of hours."
Meg," I don't understand why I have to babysit Stewie. I mean, what's he really gonna do if we leave him by himself?"
Stewie, And now to test my teleportation pods!
Stewie, Oh damn!
Stewie, I'M A MONSTER!
Stewie," So, um...t-this is, uh, awkward, but, uh, h-have we ever actually, you know, met? I mean y-you know I-I don't even know, say, for example, if you have a room up there. You know, a room? I have a room. You know, Meg, if you kill yourself now, you'll probably get a full page in the yearbook. So, um...you know, that's something to think about- (Stewie burps) Oh, I just burped."
Neil," Hi Meg, you busy Saturday night?"
Meg," Neil, you ask me out, like, once a day, and I always give you the same answer: No!"
Meg," God, I don't think I could have been any clearer the last time I turned him down."
Debra," Ray, your mother insulted my steak pizzola again."
Meg," Neil Goldman of Quahog, Rhode Island -- (Shouting) Leave me alone! I hate you! I hate you!"
Debra," Anyway, your mother insulted--"
Ray," (Cutting her off) I don't care anymore, Patty. After nine seasons, I just don't care. Maybe you could try not being a bitch."
Peter," Hey Mort, Lois and I are out on a date night, uh, why don't you give me some condoms? And some Excedrin. My wife's got a headache (moves his hands toward his crotch) THIS big. (laughing) You know? It's like from the commercial. (moves his hands toward his head) This big? Only it's my junk."
Mort," Alright, then. Twelve dollars and forty-three cents."
Peter," Aw, jeez, that's more of a ripoff than that breakfast machine I bought."
Peter," Gah! Ow! Ow, What was the point of all that? Ow, all it does is shoot ya! It doesn't make breakfast at all! Oww!"
Peter," Besides, I forgot my wallet."
Mort," Well, that's ok, I'll just open up a tab."
Peter," Wait a minute, what the hell is a tab? Does that mean I don't gotta pay?"
Mort," Well, not right now but--"
Peter," (cutting Mort off) Aww sweet! Hey, while I'm at it, gimmie all these copies of Marie Claire. Y'know in case I wanna rub out that easy one before I get Lois into bed tonight."
Mort, Kathleen Turner's on page 45.
Peter," (excited) Kathleen Turner, eh, let's see how she looks and- (turns to the right page, not excited anymore) Aww, that's a shame."
TV Announcer," And now back to the Kids' Choice Awards, with host, Paula Poundstone!"
Paula," (pointing into the audience) I choose you, and you, and you. So, come up!"
Paula, (Shouting) I said let's go!
Stewie," (shouting from upstairs) Meg! Meg, I'm hungry! There's a granola bar in the cupboard, I want it!"
Stewie, Hey. Hey! What's this? What's goin' on? Am I talking to myself up there?
Meg," Oh my God, Stewie! (Shouting) Just shut up and go to bed!"
Stewie," Do you know what I do, Meg? I spit in your mouth while you sleep."
Meg," Finally! Look, mom, I've had it! I'm not babysitting anymore! It's Saturday night, I could be out having a life!"
Lois," Meg, if you don't want to babysit anymore, that's fine, but don't you stand there and lie to me."
Peter," Oh Meg, she torched your ass, man! She torched your ass!"
Meg, Why can't you just hire a real babysitter?
Lois," Well, I guess we could do that."
Stewie, Damn! I'm terrible at meeting new people...like the time I was on Blind Date!
Woman," I'm having a great time, Stewie."
Stewie," Me too. So, uh, you ready to go grab some 'za?"
Woman, Uh...yea
Stewie drops the ball in," 3...2...1"""
Stewie," So, uh, wild guess here, but from the looks of your arm hair, I'm guessing you're Italian?"
Peter," Alright, you guys, I got eight crates of Ipecac all on my tab. Now, whoever goes the longest without puking gets the last piece of pie in the fridge."
Peter," Ok, here we go...how's everybody doin?"
Brian," Good, good so far."
Peter," Alright, alright."
Stewie, Nothing yet.
Peter," Cool, cool...You know, I dunno if you guys have had any of that pie already, but that is, uh, that is some tasty stuff. That's from the uh, bake sale that Lois was {suddenly throws up}"
Stewie," OOh, one down. I know somebody who won't be having any {throws up}"
Chris, I'm starting to feel funny.
Brian," Well, I feel fine. I guess I'm {throws up}"
Chris, Oh boy! That means I win! I get to eat {throws up}
Stewie," Oh God, why didn't anybody tell me {throws up}"
Peter," Oh my God, my insides are on {throws up}"
Stewie," No, no please, no more, no more {throws up}"
Chris," Dad, I'm scared. {throws up}"
Brian," Get the phone, call 91-{throws up}"
Peter," Lois! Lois get in here {walks backwards, throws up and hits the wall}"
Brian," OK, ok. I think it's all gone. I think [throws up}"
Stewie," I don't wanna, I don't wanna {throws up}"
Brian," Peter, Peter, I need you to hold my ears {throws up}"
Lois, Who wants chowder?
Peter," What the hell? Hey Meg, you better check this out."
Meg," Oh, God. This is so embarrassing. I can't believe this is happening to me."
Peter," Awww, looks like someone could use a greeting card to cheer 'em up. I put these on my tab. Here, take a ""Far Side"" one. The vulture thinks he's a cowboy! {laughs}"
Meg, {Chuckles} It is kinda funny.
Quagmire," Hey, Peter, you got a card for if you transferred VD to somebody?"
Peter," Uhh, let's see here...uhh...yep. ""Sorry I accidentally gave you VD"""
Quagmire," Aw, all you got is accidental, huh? All right, I'll take it."
Lois," Well, first let me thank you for answering the ad. Now, what do you feel qualifies you to be an effective babysitter for Stewie?"
Stewie," Uh, yea, uh, we couldn't run an ad that said 'No Portuguese', but, um...no Portuguese."
Lois," So, I see here that you've worked for a family for a number of years. Can I call the uh..{squints at the clipboard} Herculoids for a reference?"
Lois," I-I'm sorry, I don't understand."
Lois, The position has been filled.
Lois," The position has been filled, thank you very much, you can go now."
Lois, {Pissed off} LEAVE! NOW!
Lois, I didn't think it was going to be this hard to choose a babysitter.
Stewie," Yes, if only you were this discerning when you picked that happening hairdo."
Girl, Sorry I'm late. Can I still apply for the job?
Stewie," My God, I haven't been this exhilarated since Brian took me to see Les Miserables."
Announcer," Attention, ladies and gentlemen, there will be a slight change in the cast tonight."
Brian," Oh, no."
Announcer," For this evening's performance, the role of Jean Valjean will be played by Kirk Cameron."
Stewie," OH! Oh, unbelieveable! Oh my God! How lucky are we, huh? 'Hey Stewie, what are you doing tonight?' 'Oh, nothing, just watching KIRK CAMERON play Jean Valjean!' Oh my God! Curtain up!"
Peter," Hey Mort, do these suppositories come in other flavors?"
Mort," Peter, are you EATING those?"
Peter," {sarcastic} No, I'm shoving them up my butt! Of course I'm eating them! Gimme a carton!"
Mort," Peter, it's the end of the month, and I'm calling your tab! You owe me $34,000!"
Peter," WHAT?! Aww, man, how am I gonna come up with that kinda money?"
Mort," Peter, I'm waiting."
Peter," All right, all right, I got another idea. What if I sold you my daughter?"
Mort, Huh?
Peter," You drop the tab, and your son can have Meg."
Meg, WHAT?!
Peter," Yup, all you gotta do is sign this contract."
Meg," ARE YOU OUT OF YOUR MIND!? YOU CAN'T SELL ME, YOU FAT SON OF A BITCH!"
Peter," Woaa! Careful getting this fish off the hook, Mort, she's got some fangs. {laughs}"
Mort," What do you think of that, Neil? Daddy bought you a girlfriend!"
Neil," Excuse me, if anybody's interested, I already have a girlfriend."
Meg, There's no way--wait what?
Girl," You ready to go, honey?"
Neil," You rejected me too many times, Meg. I couldn't wait for you forever. Besides, Cecilia thinks my psoriasis is sexy."
Meg, I can't believe he's over me.
Mort, I can't believe I'm out 34 grand!
Peter," I can't believe it's not butter! {laughing} Stick around, more Family Guy comin' up!"
Lois," Peter, how could you have tried to sell our daughter?"
Peter," Alright, Lois. I don't want this to ruin our date night, so I'll make it up to ya."
Lois," Oh, Peter. {reading the card} ""I'm sorry I tried to sell our daughter""."
Peter," Yeah, you dunno how hard it was to find one of those in English."
Stewie," Ahh, tonight the babysitter comes, Rupert. Lovely LaDonne. Mmm..."
Stewie," {imitating conversation} Oh, hey LaDonne. Hey, what's goin' on? How are you? Yea. Oh, just me, Stewie. Just, uh, bein' myself. Uh...yea..Oh, uh, wha, this here? Just my package. Yea, just, just uh, just uh, my package. God delivered it, I signed for it, the world keeps on spinning. Yea."
LaDonne, Oh no! {laughs}
Stewie," Oh, Jenga, there it is! {laughs} Oh well, I guess that's why they call it Jenga, Mm? {laughs again}"
LaDonne, Stewie! You are so cute I can't even stand it!
Stewie," Oh, thank you. I'm having a good time too. I hope I don't make any social faux pas, like I did at Pamela and Tommy Lee's dinner party."
Stewie," Hi, Sorry I'm late. I was visiting my aunt in the hospital, she has hep...atitis...Oooo, sorry."
Cecilia, Neil is such an amazing guy. We just make an absolutely perfect couple.
Meg," Y'know, Neil liked me first. And I WAS gonna go out with him when I was ready to settle for him. Get your own spaz!"
Gym teacher," All right, ladies, enough chit-chat. Take it off, get in the shower, and bounce around for me."
Lois," Sweetie, your daddy and I are going to the movies tonight. How would you like LaDonne to babysit?"
Stewie," YES! Oh, I'm going to wow her tonight, Rupert. I'm gonna be cooler than Brian when he hangs out at the bowling alley."
Brian," That's what I love about high school girls, I keep gettin' older, they stay the same age {chuckles}, yes they do, yes they do."
Meg, Please go out with me. I'm just trying to make Neil jealous. I promise I'll pay and everything.
GUY," Yeah, uh, that sounds cool, but I'm gonna be in the hospital that night."
LaDonne," Hi, gorgeous man."
Stewie," Oh, you. Must I lock up your tongue with the rest of the silver? {laughs}"
LaDonne," Stewie, this is Jeremy."
Jeremy," Hey, little man. So you're the guy who's been trying to steal my girlfriend."
Stewie," Wha-you...GIRLFRIEND?! Oh, what kind of sick, twisted game are you playing at?"
LaDonne, Stewie sounds a little cranky. I'll put him to bed.
Stewie," HA! I got your hat! Take that, hatless! Now go back to the quad and resume your hackey-sack tourney! I'm not going to lie down for some frat boy bastard with his damn Teva sandals and his Skoal Bandits and his Abercrombie and Fitch long-sleeve, open stitched, crew-neck henley smoking his sticky buds out of a soda can while watching his favorite downloaded Simpson episodes every night! Yes, we all love Mr. Plow - oh, you've got the song memorized, do you? SO DOES EVERYONE ELSE! That is exactly the kind of idiot you see at Taco Bell at one in the morning - the guy who just whiffed his way down the bar-skank ladder."
LaDonne," Goodnight, Stewie."
Stewie," If he wants to throw hands, I'll throw hands! I tell you...{LaDonne puts a pacifier in Stewie's mouth}"
Meg," Oh, hey. Neil and Cecilia. I didn't expect to see you here! Meet Jake, my boyfriend!"
Jake, I want some BB's! My dad lets me shoot at cats!
Cecilia," Oh! Hi Meg! Neil and I are celebrating our two-week anniversary! Oh, it seems like only yesterday he was only a stranger videotaping me through the window."
Meg, Big deal. He did that to me 3 years ago. AND he gave me the tapes for Christmas.
Cecilia," He gave me DVDs. The production values were amazing, much better than Kramer vs. Predator."
Kramer, You want him back? You can't just dissapear for three months and suddenly decide you want him back! You can't have him! {swipes a glass of wine into the wall}
Meg," Well, I'm glad Neil's over me anyway. I'm with Jake now. Right, Jake?"
Jake, Maybe someday we'll get married and you can go up on me.
Meg, Neil! I want to be your girlfriend!
Neil, What?
Meg, I was wrong to drive you away. We belong together.
Neil, Of course I'm understandibly skeptical of your newfound affection for me.
Meg, You still got that contract our dads drew up?
Meg, Gimme that!
Cecilia, {talking to Jake} You wanna hook up?
Jake, BUY ME SOMETHING!
Meg, I can't believe we're going out. This is so cool!
Meg," Neil, Neil, n-not so fast."
Neil," {laughs} Uh, Meg, you need to fufill your contractual obligations."
Meg, What are you talking about?
Neil," All right, Meg, according to the contract, every night, you have to put on my pajamas. My mom's record is 12 seconds."
Meg," Neil, I think you're old enough to-"
Neil, {cutting Meg off} GO!
Stewie," Oh, LaDonne, I thought we could watch a DVD together. I picked up the first season of Jiminy Glick, oh, imagine being that guy for a day."
Stewie," {Stewie keeps changing positions on the chair} Colin Farrell! So, I was talking to my wife, Dixie, the other day, and she was saying that you weren't a very good actor. And I agreed with her. Now, now why, now why Colin? Why would we both say that?"
Stewie," All right, that's it! Jeremy must be destroyed!"
Jeremy, Mom?
Jeremy, Dad? Mom? Is anyone there.
Jeremy, Uh...little man? Y-you in here?
Stewie," I say, I think this is how you change a tire, but what would I know? I'm just a baby!"
Stewie," Here's your iPod, so you can listen to The Streaks while you gasp for air!"
Stewie," Oh, The Strokes, right."
Mort," Boy, this was a better aquisition than I thought. We may even be able to put in some sorghum this year."
Stewie," So, uh, anyway, um, hey! I made you a mix tape! I don't have a dual cassette player, so I had to hold the tape recorder up to the radio, so the quality's kinda sucky, but, y'know, all the songs describe my feelings."
LaDonne," I'm sorry, Stewie. I'm just upset. Jeremy stopped calling me."
Stewie," HE WHAT? That blaggard! Oh, come here, let me just, let me just hold you for a while."
LaDonne," Stewie, NO! That is a bad place to touch! No! No no no no no no no."
Stewie, B-But...but I...I...you...I...Waaaaaaaah! [Stewie starts crying]
LaDonne, No more TV!
Stewie," Well, how about no more job? Hmm? You hear that miss fussybritches? I shall see you fired, damn you! I thought we were going to go all the way and die together like Hitler and Eva Braun!"
Hitler," We do everything together, ja?"
Eva, Ja.
Hitler, You got your poison?
Eva, Mmm.
Hitler," Ok, one...two...three."
Hitler, You didn't do it!
Eva, You didn't do it either!
Hitler," Ok, ok, all right, this time we really have to do it. Ok, ready? Ok."
BOTH," One, two..."
EVA, You want me to kill myself and you're not going to! You suck! You suck!
HITLER, You suck!
Brian," Hey Stewie, there's something thunkin' around in the trunk of my car and I can't get in there because somebody busted the lock. You have, uh, any idea what that's about?"
